{
  "diagnosis_id": "diagnosis-fixed",
  "hypotheses": [
    {
      "cause": "Nonzero exit",
      "cause_category": "application_exit_nonzero",
      "confidence": "medium",
      "rationale": "Observed status",
      "supporting_evidence_ids": [
        "ev-001"
      ]
    }
  ],
  "incident_id": "incident-fixed",
  "missing_evidence": [],
  "summary": "Application exited"
}
